no,cert_type,level,subject,domain_area,q_type,item_purpose,difficulty,content,option_a,option_b,option_c,option_d,correct_answer,points,explanation,source_ref,shuffle_exempt,review_status,review_comment,version,created_by,created_date
1,AXIS,L2,AI 도구 선택·활용 전략,업무별 AI 도구 선택,multiple_choice,tool_use,medium,"마케팅팀에서 ①블로그 글 초안 작성, ②고객 리뷰 감성 분석, ③SNS 이미지 생성을 동시에 수행해야 할 때 가장 적절한 AI 도구 조합 전략은?",하나의 AI 도구로 세 가지를 모두 처리한다.,세 가지 작업을 순서대로 한 명이 수작업으로 처리한다.,각 작업에 특화된 AI 도구(텍스트 생성 AI + 데이터 분석 AI + 이미지 생성 AI)를 조합하여 사용한다.,AI 도구 없이 외주 업체에 모두 위탁한다.,C,4,"정답은 C입니다. 업무 성격이 다른 복수 작업(텍스트 생성, 데이터 분석, 이미지 생성)을 처리할 때는 각 작업에 최적화된 AI 도구를 조합하는 것이 효과적입니다. 하나의 범용 AI가 모든 작업을 최적 수준으로 처리하기 어려우며, 각 도구의 강점을 활용하면 품질과 효율 모두 높아집니다. 도구 간 워크플로우를 설계하는 것이 L2 수준의 핵심 역량입니다.",AXIS L2 AI 도구 선택·활용 전략,False,approved,배치1 신규 출제,1,,
2,AXIS,L2,AI 도구 선택·활용 전략,AI 도구 비용 효율성,multiple_choice,tool_use,medium,"팀에서 월 50건의 보고서 초안을 AI로 작성하려 할 때, 무료 AI와 유료 AI(월 $20) 중 선택 기준으로 가장 적절한 것은?",복수의 AI 도구를 사용하면 보안 위험이 감소한다.,"월 50건 처리 시 무료 AI의 토큰 한도·응답 품질·보안 정책이 업무 요구를 충족하는지 검토하고, 부족하면 유료 전환의 ROI를 산출한다.",유료 AI가 항상 더 정확하므로 무조건 유료를 선택한다.,비용은 고려하지 않고 가장 유명한 AI를 선택한다.,B,4,"정답은 B입니다. AI 도구를 선택할 때는 단순한 가격이 아니라 토큰 한도(월 사용량 충분한지), 응답 품질(보고서 수준에 적합한지), 보안 정책(사내 데이터 처리 기준 충족), 비용 대비 효과(ROI)를 종합적으로 판단해야 합니다. 무료 AI의 한계가 업무 병목이 되면 유료 전환이 효율적일 수 있습니다. 이 문항은 AI 도구 비용 효율성 판단 능력을 확인합니다.",AXIS L2 AI 도구 선택·활용 전략,False,approved,배치1 신규 출제,1,,
3,AXIS,L2,AI 도구 선택·활용 전략,AI 산출물 품질 검증,multiple_choice,case_judgment,hard,"팀원이 AI로 작성한 시장 분석 보고서에 ""2025년 국내 SaaS 시장 규모는 4.8조원""이라는 수치가 포함되어 있다. 가장 적절한 검증 방법은?",수치가 구체적이므로 정확하다고 판단하고 그대로 사용한다.,"AI가 제시한 수치의 원본 출처를 요청하고, 해당 출처(통계청, 리서치 기관 보고서 등)에서 직접 확인하여 일치 여부를 검증한다.",다른 AI에 같은 질문을 해서 같은 수치가 나오면 정확하다고 판단한다.,수치를 삭제하고 정성적 표현으로 대체한다.,B,4,"정답은 B입니다. AI가 제시하는 구체적 수치는 할루시네이션일 가능성이 높습니다. 검증 방법은 ①AI에게 출처를 요청 ②해당 출처(통계청, IDC, 가트너 등)에서 직접 확인 ③최신 데이터인지 시점 확인의 순서입니다. 다른 AI에 같은 질문을 하는 것은 교차 검증이 아닙니다(같은 학습 데이터를 공유할 수 있음). 이 문항은 AI 산출물의 수치 검증 능력을 확인합니다.",AXIS L2 AI 도구 선택·활용 전략,False,approved,배치1 신규 출제,1,,
4,AXIS,L2,AI 도구 선택·활용 전략,업무 자동화 설계,multiple_choice,tool_use,hard,"인사팀에서 매월 반복되는 ""급여 명세서 발송 → 미확인자 리마인더 → 확인 현황 집계"" 프로세스를 AI로 자동화하려 할 때 가장 적절한 접근은?",AI에게 전체 프로세스를 한 번에 자동화해달라고 요청한다.,가장 최신 버전의 AI 도구가 항상 가장 좋은 결과를 보장한다.,AI가 생성한 결과물의 정확성은 AI가 자동으로 보장하므로 별도 검증 절차가 불필요하다.,각 단계를 분리하여 ①명세서 템플릿 생성(AI) ②발송 트리거(자동화 도구) ③미확인자 필터링(스프레드시트+AI) ④리마인더 문구 생성(AI) ⑤현황 집계(데이터 도구)로 워크플로우를 설계한다.,D,4,"정답은 D입니다. 복합 업무 프로세스의 AI 자동화는 각 단계를 분리하여 적합한 도구를 배정하는 것이 핵심입니다. AI가 모든 것을 한 번에 처리하는 것이 아니라, AI(문구 생성) + 자동화 도구(트리거·발송) + 데이터 도구(필터링·집계)를 조합합니다. 급여 정보는 비식별 처리 후 AI에 입력하거나, AI는 템플릿만 생성하고 데이터는 사내 시스템에서 처리합니다. 이 문항은 AI 기반 업무 자동화 설계 능력을 확인합니다.",AXIS L2 AI 도구 선택·활용 전략,False,approved,배치1 신규 출제,1,,
5,AXIS,L2,AI 도구 선택·활용 전략,AI 도구 보안 평가,multiple_choice,tool_use,medium,기업에서 새로운 AI 도구 도입 시 보안 측면에서 가장 먼저 평가해야 할 항목은?,한 번 효과적이었던 프롬프트는 어떤 업무에도 동일하게 적용할 수 있다.,경쟁사 분석 보고서는 AI가 자체적으로 데이터를 수집하므로 별도 검증이 불필요하다.,"데이터 처리 위치(국내/해외), 학습 활용 여부(opt-out 가능 여부), 암호화 방식, SOC2/ISO27001 등 보안 인증 보유 여부",AI 기반 업무 자동화는 IT 부서만 설계할 수 있다.,C,4,"정답은 C입니다. 기업용 AI 도구 도입 시 보안 평가는 ①데이터 처리 위치(국내법 적용 여부) ②입력 데이터의 학습 활용 여부 ③전송·저장 시 암호화 방식 ④보안 인증(SOC2, ISO27001) 보유 여부를 우선 확인합니다. 이러한 항목은 기업의 정보보안 정책과 직접 연관되며, 보안 미달 도구 사용 시 데이터 유출 위험이 발생합니다. 이 문항은 AI 도구의 보안 평가 역량을 확인합니다.",AXIS L2 AI 도구 선택·활용 전략,False,approved,배치1 신규 출제,1,,
6,AXIS,L2,AI 도구 선택·활용 전략,멀티턴 대화 활용,multiple_choice,tool_use,medium,AI와의 멀티턴(다회차) 대화를 통해 보고서를 작성할 때 가장 효과적인 전략은?,①구조 잡기 → ②각 섹션 초안 생성 → ③구체화·수정 → ④전체 톤 통일 → ⑤최종 검토 순서로 단계별 대화를 진행한다.,한 번의 프롬프트에 모든 조건을 넣어 최종본을 바로 요청한다.,매번 새 대화를 시작하여 각 섹션을 독립적으로 작성한다.,첫 번째 결과를 수정 없이 사용한다.,A,4,정답은 A입니다. 멀티턴 대화를 활용한 보고서 작성은 단계별로 진행하는 것이 효과적입니다. ①전체 구조(목차) 설정 ②각 섹션 초안 ③구체적 수치·사례 보강 ④전체 톤·문체 통일 ⑤최종 검토의 순서로 진행하면 맥락이 유지되어 일관된 보고서를 얻을 수 있습니다. 매번 새 대화를 시작하면 맥락이 끊깁니다. 이 문항은 멀티턴 대화 활용 전략을 확인합니다.,AXIS L2 AI 도구 선택·활용 전략,False,approved,배치1 신규 출제,1,,
7,AXIS,L2,AI 도구 선택·활용 전략,AI 결과물 편집 전략,multiple_choice,case_judgment,medium,"AI가 작성한 제안서 초안이 전체적으로 좋지만, 도입부가 너무 일반적이고 경쟁사 비교 부분이 부정확하다. 가장 효율적인 수정 방법은?","도입부에 대해 ""우리 회사의 핵심 강점과 고객 Pain Point를 반영하여 더 구체적으로 재작성해줘""라고 요청하고, 경쟁사 비교는 검증된 데이터를 직접 입력하여 AI에게 형식만 재구성하도록 한다.",경영진에게 AI 도입 성과를 보고할 때는 기술 사양을 상세히 설명하는 것이 가장 효과적이다.,AI가 생성한 결과물의 정확성은 AI가 자동으로 보장하므로 별도 검증 절차가 불필요하다.,AI 자동화는 반복 빈도와 관계없이 모든 업무에 동일한 효과를 준다.,A,4,"정답은 A입니다. AI 결과물의 부분 수정은 ①문제 영역을 특정하고 ②구체적 개선 방향을 제시하는 것이 효율적입니다. 도입부는 방향을 구체적으로 지시하고, 경쟁사 비교처럼 사실 검증이 필요한 부분은 검증된 데이터를 사용자가 제공하여 AI가 형식만 정리하도록 합니다. ""더 좋게""는 방향이 모호합니다. 이 문항은 AI 결과물의 전략적 편집 능력을 확인합니다.",AXIS L2 AI 도구 선택·활용 전략,False,approved,배치1 신규 출제,1,,
8,AXIS,L2,AI 도구 선택·활용 전략,도구 간 연동 설계,multiple_choice,tool_use,hard,"영업팀에서 ""CRM 데이터 → AI 분석 → 주간 리포트 → 이메일 자동 발송""을 구현하려 할 때 가장 적절한 설계 방식은?",AI에게 CRM 접속 권한을 주고 모든 것을 자동으로 처리하게 한다.,CRM에서 비식별 데이터를 CSV로 추출 → AI에 분석 요청(프롬프트 템플릿 사용) → 결과를 리포트 템플릿에 삽입 → 자동화 도구(Zapier 등)로 이메일 발송하는 워크플로우를 설계한다.,CRM과 AI를 직접 API로 연결하면 보안 검토 없이도 안전하다.,AI가 제시한 리스크 분석은 별도 검증 없이 프로젝트 계획에 반영할 수 있다.,B,4,"정답은 B입니다. 도구 간 연동 설계의 핵심은 데이터 흐름을 단계별로 분리하고, 각 단계에서 보안과 품질을 관리하는 것입니다. CRM 데이터를 비식별 처리하여 추출하고, AI에는 프롬프트 템플릿으로 일관된 분석을 요청하며, 결과를 사전 설계된 리포트 형식에 삽입하고, 자동화 도구로 발송합니다. AI에 직접 CRM 접속 권한을 주면 보안 위험이 큽니다.",AXIS L2 AI 도구 선택·활용 전략,False,approved,배치1 신규 출제,1,,
9,AXIS,L2,AI 도구 선택·활용 전략,AI 활용 ROI 측정,multiple_choice,case_judgment,medium,팀에 AI 도구를 도입한 지 3개월이 지났다. AI 도입의 ROI를 측정하는 방법으로 가장 적절한 것은?,AI 도구의 사용 횟수만으로 ROI를 판단한다.,"도입 전후의 업무 소요 시간, 산출물 품질(수정 횟수 감소), 직원 만족도, AI 도구 비용을 종합하여 정량·정성 지표로 측정한다.",ROI는 1년 이상 경과해야 측정할 수 있다.,직원이 AI를 많이 사용하면 ROI가 높다고 판단한다.,B,4,"정답은 B입니다. AI 도입 ROI 측정은 ①정량 지표(업무 소요 시간 변화, 산출물 수정 횟수 감소, 비용 절감) ②정성 지표(직원 만족도, 업무 품질 변화) ③투입 비용(도구 비용, 교육 비용)을 종합하여 평가합니다. 단순 사용 횟수는 효과가 아닌 활용도만 나타내며, 실제 성과(시간 절감, 품질 향상)와 연결해야 합니다. 이 문항은 AI 도입 ROI 측정 능력을 확인합니다.",AXIS L2 AI 도구 선택·활용 전략,False,approved,배치1 신규 출제,1,,
10,AXIS,L2,AI 도구 선택·활용 전략,AI 자동화 후보 평가,multiple_choice,case_judgment,medium,다음 업무 중 AI 자동화 우선순위가 가장 높은 것은?,월 1회 수행하는 전략 보고서 작성,"주 5회 반복, 정형화된 양식, 30분 소요되는 일일 매출 현황 요약 보고",연 1회 수행하는 인사 평가 면담,고객과의 신규 계약 협상,B,4,"정답은 B입니다. AI 자동화 우선순위 평가 기준은 ①반복 빈도(주 5회) ②정형화 정도(양식 고정) ③시간 투자(30분×5=주 2.5시간) ④AI 대체 가능성(데이터 요약은 AI 적합)입니다. 일일 매출 현황 요약은 이 모든 기준에서 높은 점수를 받습니다. 전략 보고서는 빈도가 낮고, 면담과 협상은 대인 소통이 핵심이라 자동화 적합성이 낮습니다.",AXIS L2 AI 도구 선택·활용 전략,False,approved,배치1 신규 출제,1,,
11,AXIS,L2,AI 도구 선택·활용 전략,컨텍스트 윈도우 관리,multiple_choice,tool_use,hard,20페이지 분량의 계약서를 AI로 검토할 때 컨텍스트 윈도우 한계를 고려한 가장 적절한 전략은?,계약서 전체를 한 번에 입력하고 전체 검토를 요청한다.,"계약서를 논리적 섹션(당사자, 범위, 의무, 보상, 분쟁해결 등)으로 분할하고, 각 섹션을 개별 검토한 후 마지막에 섹션 간 일관성을 별도로 확인한다.",팀 규모가 작으면 AI 도구 도입 효과가 거의 없다.,변화관리 없이 AI 도구만 도입해도 조직 차원의 효과를 기대할 수 있다.,B,4,"정답은 B입니다. 컨텍스트 윈도우를 초과하는 긴 문서를 AI로 검토할 때는 논리적 섹션으로 분할하여 검토하는 전략이 효과적입니다. 각 섹션을 개별 검토한 후 마지막에 섹션 간 용어 일관성, 조건 충돌 여부를 별도로 확인합니다. 전체를 한 번에 입력하면 앞부분이 잘리거나 누락될 수 있습니다. 이 문항은 AI의 기술적 한계를 고려한 업무 전략 수립 능력을 확인합니다.",AXIS L2 AI 도구 선택·활용 전략,False,approved,배치1 신규 출제,1,,
12,AXIS,L2,AI 도구 선택·활용 전략,AI 도구 평가 프레임워크,multiple_choice,concept,medium,새로운 AI 도구를 팀에 도입하기 전에 수행해야 할 파일럿 테스트의 핵심 평가 항목으로 가장 적절한 것은?,고객 응대에 AI를 활용할 때 개인정보 제거 없이 문의를 입력해도 된다.,무료 AI 도구를 여러 개 사용하면 유료 도구 하나보다 항상 효과적이다.,AI가 생성한 결과물의 정확성은 AI가 자동으로 보장하므로 별도 검증 절차가 불필요하다.,실제 업무 데이터(비식별)로 ①응답 정확도 ②처리 속도 ③보안 정책 준수 ④기존 시스템 호환성 ⑤비용 대비 효과를 평가한다.,D,4,정답은 D입니다. AI 도구 파일럿 테스트는 광고가 아닌 실제 업무 데이터(비식별 처리)로 ①정확도(업무 목적에 맞는 결과인지) ②속도(업무 흐름에 지장 없는지) ③보안(데이터 처리 정책 충족) ④호환성(기존 도구와 연동 가능) ⑤비용(ROI)을 평가합니다. 이 문항은 AI 도구 도입 전 체계적 평가 역량을 확인합니다.,AXIS L2 AI 도구 선택·활용 전략,False,approved,배치1 신규 출제,1,,
13,AXIS,L2,AI 도구 선택·활용 전략,AI 기반 데이터 분석 보조,multiple_choice,tool_use,easy,분기 매출 데이터를 AI에게 분석 보조를 요청할 때 가장 적절한 방법은?,"매출 데이터를 AI에 입력하고 ""분석해줘""라고 요청한다.",고객 개인정보가 포함된 원본 데이터를 그대로 입력한다.,AI에게 매출 예측을 최종 결정하도록 위임한다.,"데이터 구조(컬럼명, 기간)와 분석 목적(전분기 대비 증감, 상위 제품 5개, 지역별 비교)을 구체적으로 제시하고 분석을 요청한다.",D,4,"정답은 D입니다. AI에게 데이터 분석을 요청할 때는 데이터 구조와 분석 목적을 구체적으로 제시해야 합니다. ""분석해줘""만으로는 어떤 관점의 분석인지 AI가 판단하기 어렵습니다. 데이터 입력 전 개인정보 비식별 처리도 필수입니다. AI 분석은 의사결정의 보조이며, 최종 판단은 사람이 내립니다. 이 문항은 데이터 분석에서 AI 활용 방법을 확인합니다.",AXIS L2 AI 도구 선택·활용 전략,False,approved,배치1 신규 출제,1,,
14,AXIS,L2,AI 도구 선택·활용 전략,AI 산출물 버전 관리,multiple_choice,tool_use,easy,AI를 활용하여 반복적으로 수정하는 문서의 버전을 관리하는 가장 적절한 방법은?,가장 최신 버전의 AI 도구가 항상 가장 좋은 결과를 보장한다.,팀 규모가 작으면 AI 도구 도입 효과가 거의 없다.,"각 버전에 사용한 프롬프트, AI 원본, 사람이 수정한 내역, 최종본을 구분하여 저장하고 변경 이력을 관리한다.",직원들이 AI 도구를 많이 사용할수록 조직의 AI 성숙도가 높다.,C,4,"정답은 C입니다. AI 기반 문서 작성에서 버전 관리는 ①사용 프롬프트 ②AI 원본 ③사람의 수정 내역 ④최종본을 구분 저장하여 변경 이력을 추적할 수 있게 하는 것이 중요합니다. 문제 발생 시 어느 단계에서 오류가 삽입되었는지 파악할 수 있고, 효과적인 프롬프트를 재사용할 수도 있습니다. 이 문항은 AI 산출물의 체계적 관리 역량을 확인합니다.",AXIS L2 AI 도구 선택·활용 전략,False,approved,배치1 신규 출제,1,,
15,AXIS,L2,AI 도구 선택·활용 전략,AI 도구 전환 전략,multiple_choice,concept,easy,사용 중인 AI 도구를 새 도구로 전환할 때 가장 적절한 전략은?,즉시 전체 팀이 새 도구로 전환한다.,새 도구가 더 비싸면 전환하지 않는다.,"일부 인원이 병행 운영(기존+신규)으로 핵심 업무를 테스트한 후 결과를 비교하고, 문제없으면 단계적으로 전환한다.",이전 도구의 프롬프트는 새 도구에서 동일하게 작동한다.,C,4,정답은 C입니다. AI 도구 전환은 병행 운영 기간을 두고 핵심 업무를 테스트하는 것이 안전합니다. 기존 프롬프트가 새 도구에서 다른 결과를 낼 수 있으므로 주요 프롬프트의 호환성을 확인하고 필요시 조정합니다. 즉시 전환은 업무 중단 위험이 있습니다. 이 문항은 AI 도구 전환의 체계적 접근을 확인합니다.,AXIS L2 AI 도구 선택·활용 전략,False,approved,배치1 신규 출제,1,,
16,AXIS,L2,AI 도구 선택·활용 전략,복합 업무 시나리오,multiple_choice,case_judgment,hard,"경영기획팀에서 ""분기 경영 보고서""를 AI로 작성하려 한다. 보고서에는 ①재무 실적 요약 ②시장 동향 ③경쟁사 분석 ④차기 전략 제안이 포함된다. 가장 적절한 접근은?",다국적 팀에서 사용할 프롬프트는 한 언어로만 작성하면 AI가 자동으로 번역하여 적용한다.,AI가 제시한 전략 제안은 데이터에 기반하므로 경영진의 별도 판단 없이 실행해도 무방하다.,AI 산출물의 아카이빙은 최종본만 저장하면 충분하며 프롬프트 보관은 불필요하다.,"①재무 실적은 내부 확정 수치를 기반으로 AI가 형식만 정리, ②시장 동향은 AI 초안 후 최신 자료로 교차 확인, ③경쟁사 분석은 검증된 외부 데이터 기반 AI 정리, ④전략 제안은 AI 아이디어를 참고하되 경영진 판단으로 확정한다.",D,4,"정답은 D입니다. 복합 업무에서는 각 섹션의 특성에 따라 AI 활용 수준을 차별화해야 합니다. 확정 수치(재무)는 AI가 형식만, 변동 정보(시장·경쟁사)는 교차 확인 필수, 의사결정(전략)은 AI 참고+사람 판단입니다. 이 문항은 업무 특성에 따른 AI 활용 수준 설계 능력을 확인합니다.",AXIS L2 AI 도구 선택·활용 전략,False,approved,배치1 신규 출제,1,,
17,AXIS,L2,AI 도구 선택·활용 전략,AI 업무 위임 판단,multiple_choice,case_judgment,easy,다음 중 AI에게 초안 작성을 위임하기 가장 적합한 업무는?,신입사원 대상 회사 소개 브로슈어 초안,이사회에 보고할 기밀 M&A 전략,직원 개인 인사 평가 결과 통보문,법률 분쟁 중인 소송 전략서,A,4,"정답은 A입니다. AI 위임 적합성은 ①기밀 수준(낮을수록 적합) ②개인정보 포함 여부(없을수록 적합) ③법적 리스크(낮을수록 적합) ④정형화 정도(높을수록 적합)로 판단합니다. 회사 소개 브로슈어는 공개 정보 기반이고 정형화되어 있어 AI 초안에 적합합니다. M&A 전략(기밀), 인사 평가(개인정보), 소송 전략(법적 리스크)은 부적합합니다.",AXIS L2 AI 도구 선택·활용 전략,False,approved,배치1 신규 출제,1,,
18,AXIS,L2,AI 도구 선택·활용 전략,AI 결과 일관성 관리,multiple_choice,tool_use,medium,10명이 동일한 보고서 형식을 AI로 작성할 때 결과의 일관성을 확보하는 가장 적절한 방법은?,가장 최신 버전의 AI 도구가 항상 가장 좋은 결과를 보장한다.,"팀 공용 프롬프트 템플릿(역할·목적·형식·톤·분량 지정)을 표준화하고, 출력 형식 가이드라인과 품질 체크리스트를 공유한다.",AI가 생성한 결과물의 정확성은 AI가 자동으로 보장하므로 별도 검증 절차가 불필요하다.,AI 프레젠테이션 자료는 발표자의 검토 없이 경영진에게 제출할 수 있다.,B,4,"정답은 B입니다. 팀 차원의 AI 활용에서 일관성을 확보하려면 ①공용 프롬프트 템플릿 표준화 ②출력 형식 가이드라인(헤더, 폰트, 섹션 구조) ③품질 체크리스트(필수 포함 항목, 금지 표현) ④검토 절차를 공유해야 합니다. 각자 다른 프롬프트를 사용하면 톤·형식·분량이 달라져 조직의 문서 품질이 불균일해집니다.",AXIS L2 AI 도구 선택·활용 전략,False,approved,배치1 신규 출제,1,,
19,AXIS,L2,AI 도구 선택·활용 전략,AI 활용 성숙도 진단,multiple_choice,concept,medium,조직의 AI 활용 성숙도를 진단하는 기준으로 가장 적절한 것은?,AI가 제시한 전략 제안은 데이터에 기반하므로 경영진의 별도 판단 없이 실행해도 무방하다.,AI 활용 거버넌스는 대규모 조직에만 필요하며 중소기업에서는 도입할 필요가 없다.,①활용 범위(몇 개 부서) ②활용 깊이(초안 수준 vs 워크플로우 통합) ③가이드라인 존재 여부 ④성과 측정 체계 ⑤직원 역량 수준을 종합 평가한다.,AI 윤리 위원회 구성 시 현업 부서의 참여 없이 법무팀과 IT팀만으로 충분하다.,C,4,"정답은 C입니다. 조직의 AI 활용 성숙도는 ①활용 범위(부서 확산 정도) ②활용 깊이(단순 초안 vs 업무 프로세스 통합) ③가이드라인·정책(보안, 품질, 윤리) ④성과 측정 체계(ROI, KPI) ⑤직원 역량(교육, 프롬프트 역량)을 종합적으로 평가합니다. 도구 수나 사용량만으로는 실질적 성숙도를 판단할 수 없습니다.",AXIS L2 AI 도구 선택·활용 전략,False,approved,배치1 신규 출제,1,,
20,AXIS,L2,AI 도구 선택·활용 전략,AI 산출물 형식 최적화,multiple_choice,tool_use,easy,AI에게 경영진용 보고서를 요청할 때 형식을 최적화하는 방법으로 가장 적절한 것은?,"대상(경영진), 형식(요약 1장+상세 3장), 구조(핵심 결론 먼저→근거→부록), 시각화(표·차트 포함), 톤(간결·데이터 중심)을 구체적으로 지정한다.",AI가 제시한 리스크 분석은 별도 검증 없이 프로젝트 계획에 반영할 수 있다.,팀 차원의 AI 표준화보다 개인별 자유로운 활용이 더 높은 성과를 낸다.,AI 기반 업무 자동화는 IT 부서만 설계할 수 있다.,A,4,"정답은 A입니다. 경영진용 보고서는 시간이 제한된 의사결정자가 읽는 문서이므로 형식이 특히 중요합니다. 핵심 결론을 먼저(Executive Summary), 근거를 뒤에, 상세 데이터는 부록으로 구성하고, 표·차트를 활용한 시각화가 효과적입니다. 이 문항은 대상에 맞는 AI 산출물 형식 최적화 역량을 확인합니다.",AXIS L2 AI 도구 선택·활용 전략,False,approved,배치1 신규 출제,1,,
21,AXIS,L2,AI 도구 선택·활용 전략,AI 기반 회의 효율화,multiple_choice,tool_use,easy,AI를 활용하여 회의 효율을 높이는 방법으로 가장 적절한 것은?,AI 도구 도입 전 파일럿 테스트 없이 전사 배포하는 것이 비용 효율적이다.,회의 녹음 파일만 AI에게 전달하면 완벽한 회의록이 생성된다.,"회의 전 안건 구조화(AI), 회의 중 실시간 요약(AI 보조), 회의 후 회의록·액션 아이템 정리(AI) 등 회의 전·중·후에 AI를 단계적으로 활용한다.",변화관리 없이 AI 도구만 도입해도 조직 차원의 효과를 기대할 수 있다.,C,4,"정답은 C입니다. AI 기반 회의 효율화는 ①회의 전(안건 구조화, 사전 자료 요약) ②회의 중(실시간 노트 보조) ③회의 후(회의록 작성, 액션 아이템 추출, 후속 이메일 초안)로 단계별 활용하는 것이 효과적입니다. AI는 회의를 대신하는 것이 아니라 행정적 부분을 보조합니다. 이 문항은 AI 기반 업무 프로세스 최적화 역량을 확인합니다.",AXIS L2 AI 도구 선택·활용 전략,False,approved,배치1 신규 출제,1,,
