no,cert_type,level,subject,domain_area,q_type,item_purpose,difficulty,content,option_a,option_b,option_c,option_d,correct_answer,points,explanation,source_ref,shuffle_exempt,review_status,review_comment,version,created_by,created_date
42,AXIS,L2,고급 프롬프트 설계,비교 분석 프롬프트,multiple_choice,case_judgment,medium,3개 제품의 비교 분석을 AI에게 요청할 때 가장 적절한 프롬프트 전략은?,토큰 효율을 위해 분석 목적 없이 전체 문서를 그대로 입력하는 것이 좋다.,"비교 대상, 비교 항목(가격·성능·장단점·적합 용도), 평가 기준(5점 척도), 출력 형식(비교표+종합 추천)을 구체적으로 지정하고, 각 제품의 핵심 스펙을 프롬프트에 직접 제공한다.",비교 대상만 알려주고 AI가 모든 정보를 알아서 수집하도록 한다.,네거티브 프롬프팅은 AI에게 부정적인 감정을 전달하는 기법이다.,B,3,"정답은 B입니다. 효과적인 비교 분석 프롬프트는 ①비교 대상 명시 ②비교 항목 지정 ③평가 기준(정량 척도) 설정 ④출력 형식 지정 ⑤제품 정보 직접 제공(AI가 검색하지 않도록)이 핵심입니다. AI에게 정보를 검색하게 하면 할루시네이션 위험이 높아지므로, 검증된 스펙을 사용자가 제공하는 것이 안전합니다.",AXIS L2 고급 프롬프트 설계,False,approved,배치1 신규 출제,1,,
43,AXIS,L2,고급 프롬프트 설계,조건부 분기 프롬프트,multiple_choice,prompt_advanced,medium,조건에 따라 다른 결과를 생성하도록 AI에게 요청하는 프롬프트 기법으로 가장 적절한 것은?,프롬프트 보안은 AI 개발사가 자동으로 처리하므로 사용자가 신경 쓸 필요 없다.,프롬프트 템플릿은 복잡할수록 더 좋은 결과를 만들어낸다.,"""고객 유형별로 답변을 분리해줘. VIP 고객이면 프리미엄 혜택 중심으로, 일반 고객이면 기본 서비스 중심으로, 신규 고객이면 가입 혜택 중심으로 각각 작성해줘.""",조건부 분기 프롬프트는 AI에서 기술적으로 구현할 수 없다.,C,3,"정답은 C입니다. 조건부 분기 프롬프트는 ""~이면 A, ~이면 B, ~이면 C""처럼 조건과 각 조건별 결과 방향을 명시합니다. 한 번의 요청으로 여러 시나리오에 대한 맞춤 결과를 얻을 수 있어 효율적입니다. 고객 응대, 문서 유형별 작성, 상황별 대응 매뉴얼 등에 활용됩니다. 이 문항은 조건부 분기 프롬프트 설계 능력을 확인합니다.",AXIS L2 고급 프롬프트 설계,False,approved,배치1 신규 출제,1,,
44,AXIS,L2,고급 프롬프트 설계,프롬프트 최적화 원칙,multiple_choice,concept,medium,프롬프트 최적화의 핵심 원칙으로 가장 적절한 것은?,요약 수준 제어는 AI가 자동으로 최적 수준을 판단하므로 지정할 필요 없다.,"필요한 정보를 과불족 없이 포함하되, 모호하지 않은 명확한 지시로 AI가 원하는 결과를 정확히 생성할 수 있도록 설계한다.",프롬프트 국제화는 영어로만 작성하면 모든 팀원이 사용할 수 있으므로 불필요하다.,대조 분석 프롬프트에서 AI에게 한쪽을 추천하도록 요청하면 더 유용하다.,B,3,"정답은 B입니다. 프롬프트 최적화 원칙은 ①필요 정보의 과불족 없는 포함 ②모호하지 않은 명확한 지시 ③적절한 제약조건 설정 ④반복적 개선(프롬프트 디버깅)입니다. 무조건 길다고 좋은 것이 아니며, 핵심 정보가 명확하게 전달되는 것이 중요합니다. 이 문항은 프롬프트 최적화의 기본 원칙을 이해하는지를 확인합니다.",AXIS L2 고급 프롬프트 설계,False,approved,배치1 신규 출제,1,,
45,AXIS,L2,고급 프롬프트 설계,역질문 유도 프롬프트,multiple_choice,prompt_advanced,easy,AI에게 역질문을 유도하여 더 좋은 결과를 얻는 프롬프트 기법으로 가장 적절한 것은?,"위 요청을 수행하기 전에, 더 좋은 결과를 위해 내가 추가로 제공해야 할 정보가 있으면 질문해줘.",아무 정보 없이 바로 작성해줘.,내가 제공한 정보만으로 충분하니 질문하지 마.,역질문은 AI에서 불가능하다.,A,3,"정답은 A입니다. 역질문 유도는 AI에게 ""필요한 정보가 더 있으면 질문해줘""라고 요청하여, 사용자가 미처 생각하지 못한 필수 정보를 파악하는 기법입니다. AI가 ""대상 독자는 누구인가요?"", ""예산 범위가 있나요?"" 등을 역으로 질문하면 더 구체적이고 적합한 결과를 얻을 수 있습니다. 이 문항은 역질문 유도 프롬프트 기법을 확인합니다.",AXIS L2 고급 프롬프트 설계,False,approved,배치1 신규 출제,1,,
46,AXIS,L2,고급 프롬프트 설계,멀티 페르소나 프롬프트,multiple_choice,prompt_advanced,hard,하나의 주제에 대해 여러 관점의 분석을 얻기 위한 프롬프트 기법으로 가장 적절한 것은?,JSON 출력을 원하면 AI가 자동으로 적절한 형식을 선택해준다.,대조 분석 프롬프트에서 AI에게 한쪽을 추천하도록 요청하면 더 유용하다.,"""다음 3가지 관점에서 이 제안을 각각 분석해줘: ①CFO 관점(재무 영향) ②CMO 관점(마케팅 효과) ③CTO 관점(기술 실현 가능성). 각 관점에서 장점·위험·추천 액션을 정리해줘.""",역질문 유도는 AI의 성능을 저하시키므로 사용하지 않는 것이 좋다.,C,3,"정답은 C입니다. 멀티 페르소나 프롬프트는 하나의 주제를 여러 역할(CFO, CMO, CTO 등)의 관점에서 분석하도록 요청하는 기법입니다. 각 페르소나의 평가 기준이 다르므로 다각적 분석이 가능합니다. 의사결정 전 사각지대를 줄이고 균형 잡힌 판단을 내리는 데 효과적입니다. 이 문항은 멀티 페르소나 프롬프트 설계 역량을 확인합니다.",AXIS L2 고급 프롬프트 설계,False,approved,배치1 신규 출제,1,,
47,AXIS,L2,고급 프롬프트 설계,요약 수준 제어,multiple_choice,prompt_advanced,easy,같은 문서를 경영진용 1줄 요약과 실무자용 상세 요약으로 동시에 요청하는 프롬프트로 가장 적절한 것은?,아래 보고서를 두 가지 수준으로 요약해줘: ①경영진용(핵심 결론 1문장) ②실무자용(항목별 3~5줄 요약). 두 요약을 명확히 구분해서 출력해줘.,복합 문서 변환은 각 형태를 처음부터 독립적으로 작성하는 것이 더 정확하다.,프롬프트 템플릿은 복잡할수록 더 좋은 결과를 만들어낸다.,프롬프트 라이브러리는 개인이 각자 관리하는 것이 가장 효율적이다.,A,3,"정답은 A입니다. 같은 문서에 대해 대상별 수준을 다르게 요약하려면 ①각 대상 명시 ②각 대상별 분량·형식 지정 ③구분 표시 요청이 필요합니다. 한 번의 프롬프트로 두 가지 수준의 요약을 동시에 얻으면 효율적이며, 경영진과 실무자에게 각각 적합한 형태로 전달할 수 있습니다. 고급 프롬프트 설계 역량은 AI 산출물의 품질을 직접적으로 좌우하는 핵심 역량입니다.",AXIS L2 고급 프롬프트 설계,False,approved,배치1 신규 출제,1,,
48,AXIS,L2,고급 프롬프트 설계,프롬프트 재사용 전략,multiple_choice,concept,medium,효과적이었던 프롬프트를 팀에서 재사용하기 위한 관리 방법으로 가장 적절한 것은?,"카테고리별(보고서/분석/이메일/회의록 등)로 분류하여 프롬프트 라이브러리에 저장하고, 각 프롬프트에 용도·사용 조건·효과 평가를 태그로 관리한다.",효과적인 프롬프트를 개인이 기억하고 있으면 된다.,프롬프트 설계에서 제약조건을 추가하면 AI가 혼란스러워져 결과 품질이 떨어진다.,프롬프트 공유는 보안 위험이 있으므로 금지한다.,A,3,정답은 A입니다. 프롬프트 라이브러리 관리는 ①카테고리 분류 ②용도·사용 조건 태그 ③효과 평가(결과 품질) ④버전 관리(개선 이력)를 포함합니다. 팀 전체가 검증된 프롬프트를 재사용하면 품질 일관성과 효율이 높아집니다. 프롬프트 자체에 기밀 정보가 포함되지 않으면 공유에 보안 문제는 없습니다.,AXIS L2 고급 프롬프트 설계,False,approved,배치1 신규 출제,1,,
49,AXIS,L2,고급 프롬프트 설계,복합 조건 프롬프트,multiple_choice,case_judgment,medium,마케팅 이메일을 A/B 테스트하기 위해 AI에게 변형 문구를 요청하는 프롬프트로 가장 적절한 것은?,복합 문서 변환은 각 형태를 처음부터 독립적으로 작성하는 것이 더 정확하다.,요약 수준 제어는 AI가 자동으로 최적 수준을 판단하므로 지정할 필요 없다.,"아래 제품 정보를 바탕으로 A/B 테스트용 마케팅 이메일을 2가지 버전으로 작성해줘. 버전A는 혜택 중심(가격 할인 강조), 버전B는 가치 중심(문제 해결 강조). 제목+본문 200자+CTA 버튼 문구를 각각 포함해줘.",AI 활용 거버넌스는 대규모 조직에만 필요하며 중소기업에서는 도입할 필요가 없다.,C,3,정답은 C입니다. A/B 테스트용 변형 문구를 요청할 때는 ①변형 기준(혜택 vs 가치) ②공통 구조(제목+본문+CTA) ③분량(200자) ④제품 정보 제공이 핵심입니다. 변형 기준을 명확히 하면 테스트 변수가 통제되어 A/B 테스트의 유효성이 높아집니다. 이 문항은 마케팅 목적의 프롬프트 설계 역량을 확인합니다.,AXIS L2 고급 프롬프트 설계,False,approved,배치1 신규 출제,1,,
50,AXIS,L2,고급 프롬프트 설계,프롬프트 효과 평가,multiple_choice,case_judgment,medium,프롬프트의 효과를 객관적으로 평가하는 방법으로 가장 적절한 것은?,프롬프트 효과 평가는 주관적 느낌으로 판단하는 것이 가장 정확하다.,"동일한 프롬프트로 3~5회 결과를 생성하여 ①결과의 일관성 ②원하는 조건 충족률 ③수정 필요 비율을 측정하고, 개선 전후를 비교한다.",요약 수준 제어는 AI가 자동으로 최적 수준을 판단하므로 지정할 필요 없다.,JSON 출력을 원하면 AI가 자동으로 적절한 형식을 선택해준다.,B,3,정답은 B입니다. 프롬프트 효과 평가는 ①일관성(여러 번 실행 시 유사한 결과) ②조건 충족률(지정한 형식·내용·톤 반영 비율) ③수정 비율(사람이 수정해야 하는 부분의 비율)을 측정합니다. 개선 전후를 비교하면 어떤 수정이 효과적이었는지 객관적으로 판단할 수 있습니다. 이 문항은 프롬프트 효과의 체계적 평가 역량을 확인합니다.,AXIS L2 고급 프롬프트 설계,False,approved,배치1 신규 출제,1,,
51,AXIS,L2,AI 윤리·보안 실무,개인정보 처리 실무,multiple_choice,ethics_security,medium,"마케팅팀에서 고객 데이터를 AI로 분석하려 할 때, 개인정보보호법 관점에서 가장 적절한 조치는?",고객 동의를 받았으면 원본 데이터를 AI에 입력해도 된다.,마케팅 목적이면 개인정보를 자유롭게 활용할 수 있다.,고객에게 AI 사용 사실을 알리면 신뢰가 떨어지므로 숨기는 것이 좋다.,"수집 동의와 별개로, 외부 AI 서비스에 개인정보를 전송하는 것이 동의 범위에 포함되는지 확인하고, 비식별 처리 또는 조직 내부 AI 환경 사용을 검토한다.",D,2,"정답은 D입니다. 개인정보보호법에서 수집 동의와 제3자 제공은 별도 항목입니다. 고객으로부터 수집 동의를 받았더라도, 외부 AI 서비스(제3자)에 데이터를 전송하는 것이 동의 범위에 포함되는지 별도 확인이 필요합니다. 비식별 처리하거나 조직 내부 AI 환경을 사용하면 위험을 줄일 수 있습니다. 이 문항은 개인정보 처리의 실무 판단 능력을 확인합니다.",AXIS L2 AI 윤리·보안 실무,False,approved,배치1 신규 출제,1,,
52,AXIS,L2,AI 윤리·보안 실무,저작권 실무 판단,multiple_choice,ethics_security,hard,AI가 생성한 마케팅 카피에서 유명 소설의 문구와 매우 유사한 표현이 발견되었다. 가장 적절한 대응은?,AI 채팅 기록은 대화가 끝나면 자동으로 모든 서비스에서 삭제된다.,AI 결과물에 편향된 표현이 있어도 AI가 생성한 것이므로 법적 책임이 없다.,"해당 표현이 저작권 보호 대상인지 확인하고, 유사 표현을 독창적인 문구로 교체한다. 향후 프롬프트에 ""기존 저작물과 유사하지 않은 독창적 표현으로 작성해줘""라는 조건을 추가한다.",AI 서비스의 이용약관에서 면책되므로 사용해도 된다.,C,2,"정답은 C입니다. AI는 학습 데이터의 표현을 재현할 수 있으므로, 기존 저작물과 유사한 표현이 포함될 수 있습니다. 이 경우 ①저작권 보호 대상 여부 확인 ②독창적 표현으로 교체 ③향후 예방(프롬프트에 독창성 조건 추가)이 필요합니다. AI 이용약관이 면책하더라도 사용자의 법적 책임은 별도입니다. 이 문항은 AI 저작권 실무 판단 능력을 확인합니다.",AXIS L2 AI 윤리·보안 실무,False,approved,배치1 신규 출제,1,,
53,AXIS,L2,AI 윤리·보안 실무,보안 수칙 적용,multiple_choice,ethics_security,easy,팀원이 AI 도구에 사내 전략 문서를 입력하려고 할 때 가장 적절한 대응은?,프롬프트에 역할과 조건을 상세하게 지정하면 AI가 오히려 혼란을 느껴 결과 품질이 저하된다.,"해당 AI 서비스의 데이터 처리 정책을 확인하고, 기밀 등급에 따라 입력 가능 범위를 판단하며, 필요시 기밀 정보를 제거하거나 조직이 승인한 보안 AI를 사용한다.",비식별 처리 시 성명만 삭제하면 다른 정보를 조합해도 개인을 식별하는 것은 불가능하다.,AI 산출물의 편향 여부는 사용자가 점검할 필요 없이 AI 모델이 자동으로 교정해준다.,B,2,정답은 B입니다. 사내 문서의 AI 입력 가능 여부는 ①AI 서비스의 데이터 처리 정책(저장·학습 여부) ②문서의 기밀 등급(공개/내부/대외비/극비) ③조직의 AI 사용 정책을 종합 판단합니다. 기밀 등급이 높은 문서는 승인된 보안 AI만 사용하거나 기밀 정보를 제거 후 입력해야 합니다. 이 문항은 보안 수칙의 실무 적용 능력을 확인합니다.,AXIS L2 AI 윤리·보안 실무,False,approved,배치1 신규 출제,1,,
54,AXIS,L2,AI 윤리·보안 실무,AI 결과물 책임,multiple_choice,ethics_security,medium,"AI가 작성한 계약서 검토 의견에 오류가 있어 실제 계약에 문제가 발생했을 때, 책임에 대한 설명으로 가장 적절한 것은?","AI 결과를 검토 없이 활용한 담당자와 조직에 책임이 있으며, AI는 보조 도구이므로 최종 판단과 결과에 대한 책임은 사람에게 귀속된다.",직원이 개인정보를 AI에 입력한 것을 발견해도 보고하지 않아도 된다.,AI가 작성한 것이므로 누구에게도 책임이 없다.,AI 윤리 교육은 IT 부서 직원에게만 필요하며 일반 직원에게는 불필요하다.,A,2,"정답은 A입니다. AI는 보조 도구이며, AI 결과물의 최종 활용 결정과 그에 따른 결과의 책임은 해당 결과물을 검토·승인·활용한 사람과 조직에 있습니다. 특히 법적 영향이 있는 문서(계약서, 법률 문서)는 반드시 전문가(법무팀) 검토를 거쳐야 합니다. 이 문항은 AI 결과물의 법적 책임 원칙을 이해하는지를 확인합니다.",AXIS L2 AI 윤리·보안 실무,False,approved,배치1 신규 출제,1,,
55,AXIS,L2,AI 윤리·보안 실무,AI 편향 대응,multiple_choice,case_judgment,hard,"AI가 작성한 채용 공고에서 특정 성별에 편향된 표현(""젊고 활기찬 남성 지원자 환영"")이 발견되었을 때 가장 적절한 대응은?",AI가 제시한 전략 제안은 데이터에 기반하므로 경영진의 별도 판단 없이 실행해도 무방하다.,"해당 표현을 즉시 수정하고, 향후 프롬프트에 ""성별·연령·출신 등에 편향되지 않은 포용적 표현을 사용해줘""라는 조건을 추가하며, 채용 공고 AI 사용 가이드라인에 편향 점검 절차를 포함한다.",AI 활용 거버넌스는 대규모 조직에만 필요하며 중소기업에서는 도입할 필요가 없다.,AI 윤리 위원회 구성 시 현업 부서의 참여 없이 법무팀과 IT팀만으로 충분하다.,B,2,정답은 B입니다. AI 생성 결과물의 편향은 ①즉시 수정 ②프롬프트에 포용성 조건 추가 ③가이드라인에 편향 점검 절차 포함의 3단계로 대응합니다. AI가 생성했더라도 편향된 채용 공고를 게시하면 조직이 고용차별 관련 법적 책임을 질 수 있습니다. 이 문항은 AI 편향에 대한 실무적 대응 능력을 확인합니다.,AXIS L2 AI 윤리·보안 실무,False,approved,배치1 신규 출제,1,,
56,AXIS,L2,AI 윤리·보안 실무,데이터 유출 대응,multiple_choice,ethics_security,medium,직원이 실수로 고객 개인정보를 외부 AI에 입력한 것을 발견했을 때 가장 적절한 대응 절차는?,①즉시 정보보호 담당자에게 보고 ②해당 AI 서비스에 데이터 삭제 요청 ③유출 범위 파악 ④개인정보보호법에 따른 통지·신고 절차 수행 ⑤재발 방지 교육 실시,EU AI Act 등 해외 규제는 국내 기업에 전혀 영향을 주지 않는다.,AI 이용약관의 면책 조항이 사용자 조직의 법적 책임도 면제해준다.,AI 채팅 기록은 대화가 끝나면 자동으로 모든 서비스에서 삭제된다.,A,2,"정답은 A입니다. 개인정보 유출 시 대응은 ①즉시 보고 ②데이터 삭제 요청 ③유출 범위 파악 ④법적 의무(정보주체 통지, 당국 신고) 이행 ⑤재발 방지입니다. 개인정보보호법에 따라 유출 사실을 은폐하면 더 큰 법적 제재를 받을 수 있습니다. 유출 규모와 관계없이 동일한 대응 절차가 필요합니다.",AXIS L2 AI 윤리·보안 실무,False,approved,배치1 신규 출제,1,,
57,AXIS,L2,AI 윤리·보안 실무,AI 사용 정책 수립,multiple_choice,case_judgment,medium,팀장으로서 팀의 AI 사용 정책을 수립할 때 가장 먼저 해야 할 것은?,AI 이용약관의 면책 조항이 사용자 조직의 법적 책임도 면제해준다.,EU AI Act 등 해외 규제는 국내 기업에 전혀 영향을 주지 않는다.,"조직의 정보보안 정책, 개인정보보호 규정, 업무 특성을 파악하고, 이에 부합하는 AI 허용 업무 범위·입력 금지 정보·검토 절차를 정의한다.",직원이 개인정보를 AI에 입력한 것을 발견해도 보고하지 않아도 된다.,C,2,정답은 C입니다. AI 사용 정책 수립은 ①조직의 기존 정보보안·개인정보 정책 파악 ②업무 특성에 맞는 AI 허용 범위 정의 ③입력 금지 정보 기준 설정 ④산출물 검토 절차 수립 ⑤보안 사고 대응 절차 마련 순서로 진행합니다. 정책 없이 AI를 사용하면 보안 사고 위험이 높아집니다. 실무 시나리오에서 최적의 판단을 내리기 위해서는 상황별 맥락을 종합적으로 고려해야 합니다.,AXIS L2 AI 윤리·보안 실무,False,approved,배치1 신규 출제,1,,
58,AXIS,L2,AI 윤리·보안 실무,AI 윤리적 사용,multiple_choice,ethics_security,easy,AI 결과물을 자신이 직접 작성한 것처럼 제출하는 행위에 대한 설명으로 가장 적절한 것은?,"조직의 AI 사용 정책에 따라 AI 활용 사실을 투명하게 밝히고, AI는 보조 도구로서 활용했음을 명시하는 것이 윤리적이다.",AI가 생성한 것이므로 누구의 것도 아니라서 문제없다.,AI 결과물은 항상 자신의 것으로 주장할 수 있다.,AI 사용 사실을 숨기는 것이 전략적이다.,A,2,"정답은 A입니다. AI 활용의 윤리적 원칙은 투명성입니다. AI를 보조 도구로 활용했음을 명시하고, 최종 결과에 대한 책임을 사람이 지는 것이 바람직합니다. 조직마다 AI 사용 표시 정책이 다를 수 있으므로, 조직의 가이드라인을 따라야 합니다. 이 문항은 AI 활용의 윤리적 원칙을 이해하는지를 확인합니다.",AXIS L2 AI 윤리·보안 실무,False,approved,배치1 신규 출제,1,,
59,AXIS,L2,AI 윤리·보안 실무,AI 서비스 약관 확인,multiple_choice,ethics_security,medium,AI 서비스의 이용약관에서 반드시 확인해야 할 항목으로 가장 적절한 것은?,AI 윤리 교육은 IT 부서 직원에게만 필요하며 일반 직원에게는 불필요하다.,①입력 데이터의 학습 활용 여부 ②생성물의 소유권 귀속 ③데이터 저장·보관 기간 ④제3자 공유 정책 ⑤면책 조항,비식별 처리 시 이름만 삭제하면 개인 식별이 완전히 불가능해진다.,기밀 문서라도 유료 AI 서비스에는 안전하게 입력할 수 있다.,B,2,"정답은 B입니다. AI 서비스 약관에서 ①입력 데이터 학습 활용(opt-out 가능 여부) ②생성물 소유권(사용자 귀속 여부) ③데이터 보관 기간 ④제3자 공유 ⑤면책 조항을 확인해야 합니다. 서비스마다 이 항목들이 다르므로, 업무 목적에 맞는 서비스를 선택하는 데 중요한 판단 기준입니다.",AXIS L2 AI 윤리·보안 실무,False,approved,배치1 신규 출제,1,,
60,AXIS,L2,AI 윤리·보안 실무,AI 투명성 원칙,multiple_choice,case_judgment,easy,"고객에게 발송하는 이메일이 AI로 작성되었을 때, AI 사용 사실을 고객에게 알려야 하는지에 대한 판단으로 가장 적절한 것은?",AI 사용 사실을 반드시 모든 이메일에 표시해야 한다.,국내에는 AI 관련 규제가 전혀 없으므로 자유롭게 활용할 수 있다.,AI가 생성한 결과물의 정확성은 AI가 자동으로 보장하므로 별도 검증 절차가 불필요하다.,"조직의 AI 사용 공개 정책에 따라 판단하되, 고객 신뢰와 투명성 관점에서 AI 보조 사실을 표시하는 것이 점점 보편화되고 있다.",D,2,"정답은 D입니다. AI 사용 표시는 법적 의무와 조직 정책에 따라 다릅니다. 현재 많은 조직에서 투명성 원칙에 따라 AI 보조 사실을 표시하는 추세이며, EU AI법 등 일부 규제에서는 AI 생성 콘텐츠 표시를 의무화하는 방향으로 진행 중입니다. 고객 신뢰 유지를 위해 조직 정책을 수립하는 것이 바람직합니다.",AXIS L2 AI 윤리·보안 실무,False,approved,배치1 신규 출제,1,,
61,AXIS,L2,AI 도구 선택·활용 전략,AI 기반 문서 표준화,multiple_choice,tool_use,medium,여러 부서에서 작성하는 주간 보고서의 형식을 AI로 표준화하려 할 때 가장 적절한 방법은?,AI를 사용하면 문서 작성 시간이 항상 50% 이상 단축된다.,직원들이 AI 도구를 많이 사용할수록 조직의 AI 성숙도가 높다.,"표준 보고서 구조(성과·이슈·계획)와 톤·분량을 반영한 공용 프롬프트 템플릿을 설계하고, 각 부서가 데이터만 교체하여 사용하도록 가이드한다.",AI 기반 분석 결과를 경영 의사결정의 최종 근거로 사용해도 된다.,C,4,정답은 C입니다. 문서 표준화에서 AI의 역할은 표준 구조와 톤을 반영한 프롬프트 템플릿을 설계하여 일관성을 보장하는 것입니다. 각 부서는 고정 구조(성과·이슈·계획)를 유지하면서 데이터만 교체하면 되므로 효율성과 일관성을 모두 확보합니다. 부서별 특성을 반영한 변수 영역을 두면 유연성도 유지됩니다.,AXIS L2 AI 도구 선택·활용 전략,False,approved,배치2 신규 출제,1,,
62,AXIS,L2,AI 도구 선택·활용 전략,AI 활용 교육 설계,multiple_choice,concept,medium,팀원 대상 AI 활용 교육을 설계할 때 가장 효과적인 구성은?,AI 산출물의 편향 여부는 사용자가 점검할 필요 없이 AI 모델이 자동으로 교정해준다.,AI 결과물을 다른 용도로 재활용할 때는 원본 정확성을 다시 확인할 필요가 없다.,프롬프트 라이브러리를 구축하는 것보다 매번 새로운 프롬프트를 작성하는 것이 더 창의적인 결과를 낳는다.,"①기본 사용법 → ②실제 업무 시나리오 실습 → ③프롬프트 작성 실습 → ④결과 검증·편집 → ⑤보안·윤리 가이드라인의 단계별 구성으로, 팀 업무에 직접 적용할 수 있는 실습 중심으로 설계한다.",D,4,"정답은 D입니다. AI 활용 교육은 이론보다 실습 중심이 효과적입니다. 팀의 실제 업무(보고서, 이메일, 분석 등)를 시나리오로 만들어 ①기본 사용법 ②실무 적용 ③프롬프트 작성 ④검증·편집 ⑤보안·윤리를 단계적으로 교육합니다. 외부 일반 강의보다 팀 업무에 맞춤화된 교육이 정착률이 높습니다.",AXIS L2 AI 도구 선택·활용 전략,False,approved,배치2 신규 출제,1,,
